<?xml version="1.0" encoding="utf-8"?>
<spawns xmlns:xsi="http://www.w3.org/2001/XMLSchema-instance" xsi:noNamespaceSchemaLocation="../spawns.xsd">
	<spawn_map map_id="310020000">
		<!-- Archon Legionary -->
		<spawn npc_id="205009">
			<spot x="127.0000" y="203.0000" z="225.0000" h="38" state="35" aerial_spawn="true"/>
			<spot x="164.0000" y="221.0000" z="220.0000" h="75" state="35" aerial_spawn="true"/>
			<spot x="164.0000" y="239.0000" z="220.0000" h="51" state="35" aerial_spawn="true"/>
			<spot x="165.8012" y="189.8012" z="203.0000" h="75" state="35" aerial_spawn="true"/>
			<spot x="175.0000" y="268.0000" z="212.0000" h="69" state="35" aerial_spawn="true"/>
		</spawn>
		<!-- Archon Legionary -->
		<spawn npc_id="205010">
			<spot x="109.0000" y="208.0000" z="213.0000" h="99" state="35" aerial_spawn="true"/>
			<spot x="143.0000" y="232.0000" z="199.0000" h="45" state="35" aerial_spawn="true"/>
			<spot x="151.8012" y="223.8012" z="213.0000" h="75" state="35" aerial_spawn="true"/>
			<spot x="185.0000" y="236.0000" z="223.0000" h="30" state="35" aerial_spawn="true"/>
			<spot x="188.0000" y="204.0000" z="219.0000" h="105" state="35" aerial_spawn="true"/>
		</spawn>
		<!-- Belpartan -->
		<spawn npc_id="205000">
			<spot x="85.0000" y="191.0000" z="231.6508" h="66"/>
		</spawn>
		<!-- Centurion -->
		<spawn npc_id="205005">
			<spot x="27.0000" y="154.0000" z="228.0000" h="13" state="35" aerial_spawn="true"/>
		</spawn>
		<!-- Centurion -->
		<spawn npc_id="205003">
			<spot x="40.0000" y="173.0000" z="228.0000" h="5" state="35" aerial_spawn="true"/>
		</spawn>
		<!-- Centurion -->
		<spawn npc_id="205013">
			<spot x="122.0646" y="220.6141" z="220.3087" h="15" state="35" aerial_spawn="true"/>
			<spot x="127.8492" y="194.4565" z="225.7996" h="107" state="35" aerial_spawn="true"/>
		</spawn>
		<!-- Centurion -->
		<spawn npc_id="205011">
			<spot x="140.3502" y="239.2481" z="217.5084" h="75" state="35" aerial_spawn="true"/>
			<spot x="146.7561" y="206.7927" z="217.5146" h="3" state="35" aerial_spawn="true"/>
		</spawn>
		<!-- Grunt -->
		<spawn npc_id="211044">
			<spot x="223.5400" y="283.9939" z="206.7366" h="41"/>
			<spot x="234.7777" y="285.2592" z="206.7123" h="42"/>
			<spot x="252.1250" y="214.8750" z="205.8205" h="109"/>
			<spot x="254.0000" y="300.0000" z="206.7753" h="30"/>
			<spot x="256.0000" y="303.0000" z="205.9827" h="60"/>
			<spot x="257.2039" y="241.8641" z="210.2859" h="49"/>
			<spot x="276.6125" y="295.5794" z="205.8498" h="98"/>
			<spot x="288.0000" y="229.0000" z="209.3701" h="38"/>
			<spot x="295.0000" y="248.0000" z="205.6915" h="72"/>
			<spot x="296.0000" y="276.0000" z="206.3569" h="21"/>
		</spawn>
		<!-- Legionary -->
		<spawn npc_id="205018">
			<spot x="59.5000" y="181.7500" z="228.7547" h="80"/>
			<spot x="65.7500" y="179.3750" z="228.8462" h="56"/>
		</spawn>
		<!-- Legionary -->
		<spawn npc_id="205019">
			<spot x="61.7500" y="176.3750" z="228.9820" h="58"/>
			<spot x="67.5000" y="185.7500" z="228.4363" h="81"/>
		</spawn>
		<!-- Legionary -->
		<spawn npc_id="205001">
			<spot x="63.5000" y="183.7500" z="228.7197" h="86"/>
		</spawn>
		<!-- Legionary -->
		<spawn npc_id="205002">
			<spot x="69.7500" y="181.3750" z="228.4128" h="70"/>
		</spawn>
		<!-- Legionary -->
		<spawn npc_id="205014">
			<spot x="119.0540" y="218.6892" z="221.3638" h="16" state="35" aerial_spawn="true"/>
			<spot x="126.8243" y="199.8833" z="226.0447" h="86" state="35" aerial_spawn="true"/>
		</spawn>
		<!-- Legionary -->
		<spawn npc_id="205007">
			<spot x="110.0000" y="206.0000" z="213.0000" h="38" state="35" aerial_spawn="true"/>
			<spot x="126.0000" y="205.0000" z="225.0000" h="99" state="35" aerial_spawn="true"/>
			<spot x="162.1988" y="219.1988" z="220.0000" h="15" state="35" aerial_spawn="true"/>
			<spot x="164.0000" y="188.0000" z="203.0000" h="15" state="35" aerial_spawn="true"/>
			<spot x="185.0000" y="238.0000" z="223.0000" h="90" state="35" aerial_spawn="true"/>
			<spot x="189.8012" y="202.1988" z="219.0000" h="45" state="35" aerial_spawn="true"/>
		</spawn>
		<!-- Legionary -->
		<spawn npc_id="205012">
			<spot x="142.5667" y="239.7028" z="217.5245" h="76" state="35" aerial_spawn="true"/>
			<spot x="143.0366" y="206.9177" z="218.0496" h="2" state="35" aerial_spawn="true"/>
		</spawn>
		<!-- Legionary -->
		<spawn npc_id="205008">
			<spot x="141.1988" y="233.8012" z="199.0000" h="105" state="35" aerial_spawn="true"/>
			<spot x="150.0000" y="222.0000" z="213.0000" h="15" state="35" aerial_spawn="true"/>
			<spot x="162.0000" y="240.0000" z="220.0000" h="111" state="35" aerial_spawn="true"/>
			<spot x="173.0000" y="267.0000" z="212.0000" h="8" state="35" aerial_spawn="true"/>
		</spawn>
		<!-- Legionary -->
		<spawn npc_id="205015">
			<spot x="206.0000" y="211.6710" z="216.1000" h="30" state="35" aerial_spawn="true"/>
		</spawn>
		<!-- Legionary -->
		<spawn npc_id="205016">
			<spot x="254.0000" y="303.0000" z="205.5542"/>
			<spot x="287.0000" y="231.0000" z="209.6033" h="99"/>
		</spawn>
		<!-- Legionary -->
		<spawn npc_id="205017">
			<spot x="297.0000" y="278.0000" z="206.6896" h="81"/>
		</spawn>
	</spawn_map>
</spawns>
