<?xml version="1.0" encoding="utf-8"?>
<spawns xmlns:xsi="http://www.w3.org/2001/XMLSchema-instance" xsi:noNamespaceSchemaLocation="../spawns.xsd">
	<spawn_map map_id="300360000">
		<!-- Blessed Relics -->
		<spawn npc_id="701216" respawn_time="105" difficult_id="1">
			<spot x="692.663" y="1770.740" z="219.014" aerial_spawn="true"/>
			<spot x="707.409" y="1779.437" z="165.419" aerial_spawn="true"/>
		</spawn>
		<!-- Blessed Relics -->
		<spawn npc_id="701221" respawn_time="105" difficult_id="2">
			<spot x="692.663" y="1770.740" z="219.014" aerial_spawn="true"/>
			<spot x="707.409" y="1779.437" z="165.419" aerial_spawn="true"/>
		</spawn>
		<!-- Blessed Relics -->
		<spawn npc_id="701226" respawn_time="105" difficult_id="3">
			<spot x="692.663" y="1770.740" z="219.014" aerial_spawn="true"/>
			<spot x="707.409" y="1779.437" z="165.419" aerial_spawn="true"/>
		</spawn>
		<!-- Blessed Relics -->
		<spawn npc_id="701215" respawn_time="105" difficult_id="1">
			<spot x="1848.173" y="1737.195" z="305.182"/>
		</spawn>
		<!-- Blessed Relics -->
		<spawn npc_id="701220" respawn_time="105" difficult_id="2">
			<spot x="1848.173" y="1737.195" z="305.182"/>
		</spawn>
		<!-- Blessed Relics -->
		<spawn npc_id="701225" respawn_time="105" difficult_id="3">
			<spot x="1848.173" y="1737.195" z="305.182"/>
		</spawn>
		<!-- Crater -->
		<spawn npc_id="701219" respawn_time="30" difficult_id="1">
			<spot x="676.005" y="1766.244" z="171.897" aerial_spawn="true"/>
			<spot x="680.167" y="1767.332" z="164.170" aerial_spawn="true"/>
			<spot x="682.348" y="1780.562" z="164.022" aerial_spawn="true"/>
			<spot x="682.538" y="1762.745" z="164.170" aerial_spawn="true"/>
			<spot x="691.514" y="1760.514" z="164.170" aerial_spawn="true"/>
			<spot x="693.787" y="1780.437" z="163.861" aerial_spawn="true"/>
			<spot x="695.261" y="1765.080" z="164.170" aerial_spawn="true"/>
			<spot x="697.315" y="1777.487" z="163.861" aerial_spawn="true"/>
			<spot x="700.407" y="1756.772" z="177.998" aerial_spawn="true"/>
			<spot x="701.967" y="1765.882" z="164.438" aerial_spawn="true"/>
			<spot x="703.459" y="1775.125" z="164.438" aerial_spawn="true"/>
			<spot x="706.059" y="1761.232" z="163.933" aerial_spawn="true"/>
			<spot x="707.120" y="1768.369" z="164.189" aerial_spawn="true"/>
			<spot x="711.216" y="1772.974" z="164.674" aerial_spawn="true"/>
		</spawn>
		<!-- Crater -->
		<spawn npc_id="701224" respawn_time="30" difficult_id="2">
			<spot x="676.005" y="1766.244" z="171.897" aerial_spawn="true"/>
			<spot x="680.167" y="1767.332" z="164.170" aerial_spawn="true"/>
			<spot x="682.348" y="1780.562" z="164.022" aerial_spawn="true"/>
			<spot x="682.538" y="1762.745" z="164.170" aerial_spawn="true"/>
			<spot x="691.514" y="1760.514" z="164.170" aerial_spawn="true"/>
			<spot x="693.787" y="1780.437" z="163.861" aerial_spawn="true"/>
			<spot x="695.261" y="1765.080" z="164.170" aerial_spawn="true"/>
			<spot x="697.315" y="1777.487" z="163.861" aerial_spawn="true"/>
			<spot x="700.407" y="1756.772" z="177.998" aerial_spawn="true"/>
			<spot x="701.967" y="1765.882" z="164.438" aerial_spawn="true"/>
			<spot x="703.459" y="1775.125" z="164.438" aerial_spawn="true"/>
			<spot x="706.059" y="1761.232" z="163.933" aerial_spawn="true"/>
			<spot x="707.120" y="1768.369" z="164.189" aerial_spawn="true"/>
			<spot x="711.216" y="1772.974" z="164.674" aerial_spawn="true"/>
		</spawn>
		<!-- Crater -->
		<spawn npc_id="701229" respawn_time="30" difficult_id="3">
			<spot x="676.005" y="1766.244" z="171.897" aerial_spawn="true"/>
			<spot x="680.167" y="1767.332" z="164.170" aerial_spawn="true"/>
			<spot x="682.348" y="1780.562" z="164.022" aerial_spawn="true"/>
			<spot x="682.538" y="1762.745" z="164.170" aerial_spawn="true"/>
			<spot x="691.514" y="1760.514" z="164.170" aerial_spawn="true"/>
			<spot x="693.787" y="1780.437" z="163.861" aerial_spawn="true"/>
			<spot x="695.261" y="1765.080" z="164.170" aerial_spawn="true"/>
			<spot x="697.315" y="1777.487" z="163.861" aerial_spawn="true"/>
			<spot x="700.407" y="1756.772" z="177.998" aerial_spawn="true"/>
			<spot x="701.967" y="1765.882" z="164.438" aerial_spawn="true"/>
			<spot x="703.459" y="1775.125" z="164.438" aerial_spawn="true"/>
			<spot x="706.059" y="1761.232" z="163.933" aerial_spawn="true"/>
			<spot x="707.120" y="1768.369" z="164.189" aerial_spawn="true"/>
			<spot x="711.216" y="1772.974" z="164.674" aerial_spawn="true"/>
		</spawn>
		<!-- Lava Floor -->
		<spawn npc_id="701218" respawn_time="30" difficult_id="1">
			<spot x="687.888" y="1766.859" z="163.000"/>
			<spot x="688.366" y="1777.590" z="163.000"/>
			<spot x="699.176" y="1772.244" z="163.000"/>
			<spot x="707.605" y="1779.565" z="163.673"/>
		</spawn>
		<!-- Lava Floor -->
		<spawn npc_id="701223" respawn_time="30" difficult_id="2">
			<spot x="687.888" y="1766.859" z="163.000"/>
			<spot x="688.366" y="1777.590" z="163.000"/>
			<spot x="699.176" y="1772.244" z="163.000"/>
			<spot x="707.605" y="1779.565" z="163.673"/>
		</spawn>
		<!-- Lava Floor -->
		<spawn npc_id="701228" respawn_time="30" difficult_id="3">
			<spot x="687.888" y="1766.859" z="163.000"/>
			<spot x="688.366" y="1777.590" z="163.000"/>
			<spot x="699.176" y="1772.244" z="163.000"/>
			<spot x="707.605" y="1779.565" z="163.673"/>
		</spawn>
		<!-- Red Sand Tog -->
		<spawn npc_id="218693" respawn_time="105" difficult_id="1">
			<spot x="1856.197" y="1071.305" z="337.287" h="90"/>
		</spawn>
		<!-- Red Sand Tog -->
		<spawn npc_id="218706" respawn_time="105" difficult_id="2">
			<spot x="1856.197" y="1071.305" z="337.287" h="90"/>
		</spawn>
		<!-- Red Sand Tog -->
		<spawn npc_id="218719" respawn_time="105" difficult_id="3">
			<spot x="1856.197" y="1071.305" z="337.287" h="90"/>
		</spawn>
		<!-- Red Sand Tog -->
		<spawn npc_id="233058" respawn_time="105" difficult_id="4">
			<spot x="1856.197" y="1071.305" z="337.287" h="90"/>
		</spawn>
		<!-- Tog Manger -->
		<spawn npc_id="218757" respawn_time="105">
			<spot x="1853.310" y="1072.531" z="337.734"/>
		</spawn>
		<!-- Treasure Box -->
		<spawn npc_id="218802" respawn_time="105">
			<spot x="297.641" y="1239.489" z="267.572"/>
		</spawn>
	</spawn_map>
</spawns>
